{
  "request": {
    "id": "login-form-2026-04-15",
    "source": "hive-compose",
    "raw_input": "Login Form",
    "timestamp": "2026-04-15T00:00:00Z"
  },
  "intent": {
    "goal": "Build a Login Form component using Velocity DS primitives — email field, password field with show/hide toggle, remember-me checkbox, and a primary submit button",
    "domain": "authentication-ui",
    "constraints": [
      "Use only grounded Velocity DS components (Form, Input, Button, Checkbox, Label)",
      "No new component invention — log gaps",
      "Semantic design tokens only (no raw hex or arbitrary values)",
      "Base UI primitives for accessible field/error binding",
      "Tailwind utility classes consistent with existing DS patterns",
      "Vertical form layout (single column)",
      "fullWidth Button for primary CTA"
    ],
    "success_criteria": [
      "Email and password fields render with proper labels and accessible error messages",
      "Submit button supports loading state during async auth",
      "Password field has show/hide toggle via trailingIcon",
      "Remember-me checkbox is present and accessible",
      "All form fields surface validation errors via FormMessage (Field.Error)",
      "Component composes cleanly from Velocity exports"
    ],
    "scope": "single-component"
  },
  "ground": {
    "patterns": [
      {
        "id": "vertical-form",
        "name": "Vertical Form Layout",
        "description": "Single-column stacked form with gap-6 between fields. Used for compact auth and settings forms.",
        "source": "src/components/Form/Form.tsx"
      },
      {
        "id": "field-with-error",
        "name": "FormField with inline error",
        "description": "FormField wrapping FormLabel + Input + FormMessage. FormMessage renders via Field.Error and is only visible when invalid=true on FormField.",
        "source": "src/components/Form/Form.tsx"
      },
      {
        "id": "fullwidth-cta",
        "name": "Full-width primary CTA button",
        "description": "Button with variant=solid, colorScheme=primary, fullWidth=true, type=submit. Supports loading spinner.",
        "source": "src/components/Button/Button.tsx"
      }
    ],
    "components": [
      {
        "name": "Form",
        "path": "src/components/Form/Form.tsx",
        "export": "Form",
        "props": {
          "layout": "'vertical' | 'horizontal'",
          "children": "ReactNode",
          "className": "string"
        },
        "usage": "Root form element. Use layout='vertical' for login forms."
      },
      {
        "name": "FormSection",
        "path": "src/components/Form/Form.tsx",
        "export": "FormSection",
        "props": {
          "title": "string?",
          "description": "string?",
          "children": "ReactNode"
        },
        "usage": "Optional section grouping with title/description heading."
      },
      {
        "name": "FormField",
        "path": "src/components/Form/Form.tsx",
        "export": "FormField",
        "props": {
          "name": "string",
          "invalid": "boolean",
          "disabled": "boolean",
          "children": "ReactNode"
        },
        "usage": "Wraps Field.Root. Provides field-level invalid/disabled state to children via context."
      },
      {
        "name": "FormLabel",
        "path": "src/components/Form/Form.tsx",
        "export": "FormLabel",
        "props": {
          "required": "boolean",
          "children": "ReactNode"
        },
        "usage": "Renders Field.Label. Shows required asterisk when required=true."
      },
      {
        "name": "FormDescription",
        "path": "src/components/Form/Form.tsx",
        "export": "FormDescription",
        "props": { "children": "ReactNode" },
        "usage": "Optional helper text rendered below the label."
      },
      {
        "name": "FormMessage",
        "path": "src/components/Form/Form.tsx",
        "export": "FormMessage",
        "props": { "children": "ReactNode" },
        "usage": "Renders Field.Error. Visible only when FormField has invalid=true. Text is feedback-negative color."
      },
      {
        "name": "FormActions",
        "path": "src/components/Form/Form.tsx",
        "export": "FormActions",
        "props": { "children": "ReactNode" },
        "usage": "Flex row container for bottom-of-form actions (buttons, links). Has pt-2 built in."
      },
      {
        "name": "Input",
        "path": "src/components/Input/Input.tsx",
        "export": "Input",
        "props": {
          "size": "'sm' | 'md' | 'lg'",
          "error": "boolean",
          "helperText": "string?",
          "leadingIcon": "ReactNode?",
          "trailingIcon": "ReactNode?",
          "leadingAddon": "ReactNode?",
          "trailingAddon": "ReactNode?",
          "label": "string?",
          "type": "string",
          "placeholder": "string",
          "disabled": "boolean"
        },
        "usage": "Core text input. Use trailingIcon for password visibility toggle button."
      },
      {
        "name": "Button",
        "path": "src/components/Button/Button.tsx",
        "export": "Button",
        "props": {
          "variant": "'solid' | 'outline' | 'ghost' | 'link'",
          "size": "'sm' | 'md' | 'lg'",
          "colorScheme": "'primary' | 'success' | 'warning' | 'danger' | 'neutral'",
          "loading": "boolean",
          "fullWidth": "boolean",
          "type": "'button' | 'submit' | 'reset'",
          "startIcon": "ReactNode?",
          "endIcon": "ReactNode?",
          "disabled": "boolean"
        },
        "usage": "Primary CTA: variant=solid, colorScheme=primary, fullWidth=true, type=submit."
      },
      {
        "name": "Checkbox",
        "path": "src/components/Checkbox/Checkbox.tsx",
        "export": "Checkbox",
        "props": {
          "checked": "boolean",
          "defaultChecked": "boolean",
          "onCheckedChange": "(checked: boolean) => void",
          "size": "'sm' | 'md' | 'lg'",
          "disabled": "boolean",
          "name": "string",
          "children": "ReactNode"
        },
        "usage": "Remember-me toggle. Use children prop for inline label."
      },
      {
        "name": "Label",
        "path": "src/components/Label/Label.tsx",
        "export": "Label",
        "props": {
          "size": "'sm' | 'md' | 'lg'",
          "disabled": "boolean",
          "required": "boolean",
          "children": "ReactNode"
        },
        "usage": "Standalone label. Prefer FormLabel inside FormField for proper Field.Label binding."
      }
    ],
    "tokens": {
      "colors": {
        "surface-primary": "Form card background",
        "surface-secondary": "Input addon background",
        "border-default": "Input/card border",
        "border-brand": "Focused input border",
        "border-focus": "Focus ring color",
        "content-primary": "Primary text, labels",
        "content-secondary": "Placeholder, helper text",
        "content-tertiary": "Subtle placeholder",
        "content-brand": "Brand-colored text",
        "accent-primary": "Primary button background, checked checkbox",
        "feedback-negative": "Error text, required asterisk",
        "state-error": "Error border",
        "background-primary": "Page/focus-ring offset"
      },
      "spacing": {
        "gap-1.5": "Label-to-input gap (FormField default)",
        "gap-4": "Inter-section gap",
        "gap-6": "Inter-field gap (Form vertical default)",
        "p-8": "Card padding (32px — 4×8px grid)"
      },
      "radius": {
        "rounded-xl": "Input, md/sm buttons",
        "rounded-2xl": "Card, lg buttons"
      },
      "typography": {
        "text-sm": "Input text, labels (md size)",
        "text-xs": "Helper/error text",
        "font-medium": "Labels, button text"
      }
    },
    "rules": {
      "layout": {
        "grid": "8px base grid",
        "column": "single-column for auth forms",
        "maxWidth": "400px (recommended for login)",
        "formSpacing": "gap-6 between fields (Form default)",
        "fieldSpacing": "gap-1.5 between label and input (FormField default)"
      },
      "accessibility": {
        "fieldBinding": "Always use FormField > FormLabel + Input pattern for proper label-control association via Field.Root",
        "errorAnnouncement": "FormMessage renders Field.Error which announces via aria-live when invalid",
        "requiredIndicator": "Use FormLabel required=true — asterisk is aria-hidden, label text alone must convey requirement for screen readers",
        "passwordToggle": "Password show/hide button must have aria-label; input type switches between 'password' and 'text'",
        "loadingState": "Button loading=true sets disabled internally; ensure aria-busy on form during submission"
      },
      "constraints": [
        "Primary CTA must use variant=solid + colorScheme=primary",
        "Do not use raw hex colors — use semantic token classes only",
        "FormField must wrap any Input that needs error display",
        "Do not use standalone Label inside FormField — use FormLabel for proper Field.Label binding"
      ]
    },
    "docs": [],
    "examples": []
  },
  "compose": {
    "blueprint": {
      "id": "login-form-blueprint-2026-04-15",
      "title": "Login Form",
      "goal": "Build a Login Form component using Velocity DS primitives — email field, password field with show/hide toggle, remember-me checkbox, and a primary submit button",
      "layout": {
        "type": "single-column-card",
        "sections": [
          { "id": "form-header", "description": "Title and subtitle above the form", "position": "top" },
          { "id": "email-field", "description": "Email address field with label, input, and error message", "position": "field-1" },
          { "id": "password-field", "description": "Password field with show/hide toggle, label, input, and error message", "position": "field-2" },